{
  "$schema": "https://json-schema.org/draft/2020-12/schema",
  "$id": "urn:mind-palace:schema:common-memory-installation:0.1.0",
  "title": "Mind Palace common-memory installation",
  "type": "object",
  "required": [
    "installation_id",
    "trust_domain",
    "storage_binding",
    "active_release",
    "releases",
    "legacy_installations",
    "client_receipts"
  ],
  "properties": {
    "installation_id": {"type": "string", "minLength": 1},
    "trust_domain": {"type": "string", "minLength": 1},
    "storage_binding": {"type": "string", "minLength": 1},
    "active_release": {"type": ["string", "null"]},
    "releases": {
      "type": "array",
      "items": {
        "type": "object",
        "required": ["id", "protocol", "package_locator", "source_version", "status"],
        "properties": {
          "id": {"type": "string", "minLength": 1},
          "protocol": {
            "type": "object",
            "required": ["id", "version"],
            "properties": {
              "id": {"const": "mind-palace"},
              "version": {"$ref": "#/$defs/semver"}
            },
            "additionalProperties": true
          },
          "package_locator": {"type": "string", "minLength": 1},
          "source_version": {"type": "string", "minLength": 1},
          "status": {"enum": ["staged", "active", "retired", "blocked"]},
          "components": {
            "type": "array",
            "items": {"$ref": "#/$defs/resource"}
          },
          "release_index": {
            "type": "object",
            "required": ["path", "digest", "locator"],
            "properties": {
              "path": {"const": "protocol/release-index.yaml"},
              "digest": {"type": "string", "pattern": "^sha256:[a-f0-9]{64}$"},
              "locator": {"type": "string", "minLength": 1}
            },
            "additionalProperties": true
          },
          "core_bundle": {
            "type": "array",
            "minItems": 1,
            "items": {"$ref": "#/$defs/resource"}
          },
          "payload": {
            "type": "object",
            "required": ["filename", "media_type", "bytes", "digest", "release_index_digest"],
            "properties": {
              "filename": {"type": "string", "pattern": "\\.md$"},
              "media_type": {"const": "text/markdown"},
              "bytes": {"type": "integer", "minimum": 1},
              "digest": {"type": "string", "pattern": "^sha256:[a-f0-9]{64}$"},
              "release_index_digest": {"type": "string", "pattern": "^sha256:[a-f0-9]{64}$"}
            },
            "additionalProperties": true
          },
          "source_pointer": {
            "type": "object",
            "required": ["source_revision", "release_index"],
            "properties": {
              "source_revision": {"type": "string", "minLength": 1},
              "release_index": {"$ref": "#/$defs/resource"}
            },
            "additionalProperties": true
          },
          "awareness": {
            "type": "object",
            "required": ["path", "digest", "bytes"],
            "description": "The derived awareness-core projection materialized on the release record. It is a non-authoritative rendering of protocol guidance; the immutable Git release remains authoritative.",
            "properties": {
              "path": {"const": "protocol/awareness-core.md"},
              "digest": {"type": "string", "pattern": "^sha256:[a-f0-9]{64}$"},
              "bytes": {"type": "integer", "minimum": 1}
            },
            "additionalProperties": true
          },
          "omissions": {"type": "array", "items": {"type": "string"}}
        },
        "oneOf": [
          {"required": ["components"]},
          {"required": ["release_index", "core_bundle"]},
          {"required": ["payload"]},
          {"required": ["source_pointer"]}
        ],
        "additionalProperties": true
      }
    },
    "legacy_installations": {
      "type": "array",
      "items": {
        "type": "object",
        "required": ["id", "locator", "disposition"],
        "properties": {
          "id": {"type": "string", "minLength": 1},
          "locator": {"type": "string", "minLength": 1},
          "disposition": {"enum": ["unreviewed", "retained-read-only", "mapped", "superseded", "blocked"]}
        },
        "additionalProperties": true
      }
    },
    "client_receipts": {
      "type": "array",
      "items": {
        "type": "object",
        "required": ["client_id", "receipt_locator"],
        "properties": {
          "client_id": {"type": "string", "minLength": 1},
          "receipt_locator": {"type": "string", "minLength": 1}
        },
        "additionalProperties": true
      }
    }
  },
  "additionalProperties": true,
  "$defs": {
    "resource": {
      "type": "object",
      "required": ["path", "digest", "locator"],
      "properties": {
        "path": {"type": "string", "minLength": 1},
        "digest": {"type": "string", "pattern": "^sha256:[a-f0-9]{64}$"},
        "locator": {"type": "string", "minLength": 1}
      },
      "additionalProperties": true
    },
    "semver": {
      "type": "string",
      "pattern": "^(0|[1-9][0-9]*)\\.(0|[1-9][0-9]*)\\.(0|[1-9][0-9]*)(?:-((?:0|[1-9][0-9]*|[0-9]*[A-Za-z-][0-9A-Za-z-]*)(?:\\.(?:0|[1-9][0-9]*|[0-9]*[A-Za-z-][0-9A-Za-z-]*))*))?(?:\\+([0-9A-Za-z-]+(?:\\.[0-9A-Za-z-]+)*))?$"
    }
  }
}
